income,grades,district,url,headline
-2.152039851907663,0.506534504166335,independent,https://www.independent.co.uk/news/world/europe/turkey-earthquake-latest-death-toll-rescue-survivors-elazig-malatya-a9302246.html,turkey earthquake: two-year-old pulled from rubble as death toll rises to 31
-2.177320995792819,-0.3391701937809508,bbc,https://www.bbc.co.uk/news/world-europe-51256908,turkey earthquake: rescue efforts near end as death toll rises
4.526698197891305,-2.0124285007670446,metro,https://metro.co.uk/2020/01/26/hunt-survivors-turkey-earthquake-death-toll-jumps-31-12124534/,hunt for survivors in turkey earthquake as death toll jumps to 31
3.8910929345768555,3.6187047820941993,metro,https://metro.co.uk/2020/01/25/desperate-hunt-survivors-death-toll-turkey-earthquake-rises-22-12120338/,desperate hunt for survivors as death toll from turkey earthquake rises to 22
0.2947615109764372,-2.6493780857626197,mirror,https://www.mirror.co.uk/news/world-news/girl-5-pull-rubble-collapsed-21362413,"girl, 5, pulled from rubble of collapsed building 24 hours after turkey earthquake"
-4.383191795744113,0.8757374940500815,independent,https://www.independent.co.uk/news/world/europe/turkey-earthquake-latest-death-toll-sivrice-elazig-damage-aftershocks-a9301266.html,turkey earthquake: death toll rises to 29 after major tremor hits elazig province
1,1,"Turkey, Earthquake, Toll, Death, Rubble"
