income,grades,district,url,headline
-1.904379231883464,0.35387229319827795,sky,http://news.sky.com/story/anthony-knott-police-believe-body-found-in-river-is-missing-firefighter-11905287,anthony knott: police believe body found in river is missing firefighter
-2.1140053257300644,-2.6668780937896415,independent,https://www.independent.co.uk/news/uk/home-news/anthony-knott-missing-found-search-body-river-ouse-newhaven-police-lewes-a9278201.html,anthony knott: body of missing firefighter found in sussex
-0.5000962210046521,3.5931793504931195,metro,https://metro.co.uk/2020/01/10/body-pulled-river-believed-missing-firefighter-anthony-knott-12036869/,body pulled from river believed to be missing firefighter anthony knott
9.95106695633005,-0.7442760430181465,mirror,https://www.mirror.co.uk/news/uk-news/breaking-anthony-knott-body-believed-21253699,anthony knott: body believed to be missing firefighter dad-of-four found in river
-2.020052763408559,-2.849032052621866,theguardian,https://www.theguardian.com/uk-news/2020/jan/10/police-find-body-in-river-ouse-believed-to-be-missing-firefighter-anthony-knott,police find body in river ouse believed to be missing firefighter
-1.2154658606656537,3.6331503067246786,bbc,https://www.bbc.co.uk/news/uk-england-sussex-51065832,anthony knott: body of missing firefighter found
-2.197067553637659,-1.3200157609864203,sun,https://www.thesun.co.uk/news/10711773/anthony-knott-missing-firefighter-lewes/,"cops searching for missing firefighter anthony knott, 33, find body three weeks after christmas disappearance"
1,1,"Firefighter, Anthony, Body, Knott, River"
