income,grades,district,url,headline
-0.9509275928598896,-3.916083915696754,metro,https://metro.co.uk/2019/12/04/donald-trump-trouble-directions-nato-summit-11268953/,donald trump has trouble with directions at nato summit
-1.5801256492994051,-3.0638117668221465,sun,https://www.thesun.co.uk/news/10470505/boris-johnson-donald-trump-talks/,boris johnson insists he will hold talks with donald trump at nato summit
5.876919983471741,2.1016529854227226,mirror,https://www.mirror.co.uk/news/uk-news/breaking-donald-trump-arrives-uk-21011536,donald trump arrives in uk for the nato summit and to meet the queen
5.1272830536976155,0.2883048837822628,bbc,https://www.bbc.co.uk/news/uk-50632385,donald trump touches down in uk ahead of nato summit
-3.5444444877383203,0.16461050928509083,bbc,https://www.bbc.co.uk/news/world-europe-50651695,nato summit: trump and macron clash in london
-4.928705307271743,4.4253273040288255,independent,https://www.independent.co.uk/news/uk/home-news/nato-summit-trump-macron-trudeau-boris-johnson-video-stoltenberg-a9233191.html,how a viral video and a donald trump tantrum derailed the nato summit
1,1,"Nato, Summit"
