income,grades,district,url,headline
4.262942483837935,-0.409352943507837,theguardian,https://www.theguardian.com/us-news/2020/mar/04/coronavirus-new-york-family,coronavirus: us death toll climbs to 11 as california declares state of emergency
-5.355405332667743,5.000599557140957,metro,https://metro.co.uk/2020/03/04/first-coronavirus-death-california-us-death-toll-hits-11-12350390/,first coronavirus death in california as us death toll hits 11
5.499083687193503,3.444708656891139,theguardian,https://www.theguardian.com/world/2020/mar/02/coronavirus-death-toll-passes-3000-worldwide-as-second-person-dies-in-us,"coronavirus: death toll passes 3,000 worldwide as second person dies in us"
2.3500757817317557,-0.6145555082344109,theguardian,https://www.theguardian.com/world/2020/feb/29/joe-biden-trump-coronavirus-hoax-claim,trump fends off criticism of 'hoax' remark after first us coronavirus death
-5.441128831897233,-1.037878236279385,independent,https://www.independent.co.uk/news/world/americas/coronavirus-us-death-toll-california-outbreak-cruise-ship-grand-princess-latest-a9376761.html,coronavirus: california declares state of emergency as us virus death toll rises
0.4943983992766537,-2.6794331622757093,sun,https://www.thesun.co.uk/news/11090327/us-readies-for-coronavirus-pandemic-as-more-than-100-infected-and-up-to-a-million-set-to-be-tested-this-week/,coronavirus death toll rises to nine in us with more than 100 others infected by deadly virus
-1.8099661874748691,-3.7040883637347544,bbc,https://www.bbc.co.uk/news/world-us-canada-51740706,coronavirus: california declares emergency after death
1,1,"Coronavirus, Death, Toll, California, Emergency"
