income,grades,district,url,headline
-2.8328018042095793,1.0464823516092683,sky,http://news.sky.com/story/james-bond-fans-call-for-no-time-to-die-release-to-be-delayed-due-to-coronavirus-11948428,james bond fans call for no time to die release to be delayed due to coronavirus
-0.3232047850210103,-3.7136141126003963,bbc,https://www.bbc.co.uk/news/entertainment-arts-51744374,release of james bond film no time to die delayed amid coronavirus fears
6.916134726262828,2.43336062996346,dailymail,https://www.dailymail.co.uk/news/article-8074959/Release-new-James-Bond-film-No-Time-Die-pushed-April-November.html,release of new james bond film no time to die is pushed back from april to november because of coronavirus outbreak
-3.5093202915026622,4.098178372074442,metro,https://metro.co.uk/2020/03/02/bond-fans-want-no-time-dies-release-date-pushed-back-coronavirus-12336422/,bond fans want no time to die’s release date pushed back because of coronavirus
-1.8114321366192854,-1.5858209177060016,sky,http://news.sky.com/story/no-time-to-die-james-bond-release-date-pushed-back-due-to-coronavirus-11949562,james bond film no time to die delayed by seven months due to coronavirus
1.5606242910897055,-2.278586323340778,bbc,https://www.bbc.co.uk/news/entertainment-arts-51720354,bond fans ask for no time to die delay due to coronavirus
1,1,"Bond, Die, Coronavirus, Time, No"
