income,grades,district,url,headline
-1.4234492050198193,-2.7029413504631754,sky,http://news.sky.com/story/goo-hara-korean-pop-star-28-found-dead-at-her-home-11869430,"goo hara: korean pop star, 28, found dead at her home"
-2.4451119786347557,3.6105523420166734,sun,https://www.thesun.co.uk/news/10401017/goo-hara-dead-k-pop/,goo hara dead aged 28 – k-pop star found dead at home six months after suicide bid
-1.9283875700424649,-1.3477971566543914,metro,https://metro.co.uk/2019/11/24/goo-hara-fans-can-pay-respects-special-venue-k-pop-star-found-dead-aged-28-11212346/,goo hara fans can pay respects at special venue after k-pop star is ‘found dead’ aged 28
10.217176758224896,0.4809311947378669,dailymail,https://www.dailymail.co.uk/news/article-7719945/K-Pop-star-Goo-Hara-28-dead-home-six-months-suicide-attempt.html,"k pop star goo hara, 28, is found dead at home just two weeks after launching her comeback tour following suicide attempt six months ago"
-1.651242718155689,-2.3663334540163614,bbc,https://www.bbc.co.uk/news/world-asia-50535937,k-pop artist goo hara found dead at home aged 28
-2.7689852863721676,2.32558842437939,metro,https://metro.co.uk/2019/11/24/k-pop-star-former-kara-member-goo-hara-found-dead-28-11209087/,k-pop star and former kara member goo hara ‘found dead’ at 28
1,1,"Dead, Goo, Hara, Home, K-Pop"
