income,grades,district,url,headline
-0.37830921110496396,-1.262035575708544,theguardian,https://www.theguardian.com/world/2020/feb/24/british-tourists-stranded-in-canary-islands-after-saharan-sandstorm-blows-in,tourists stranded in canary islands after saharan sandstorm blows in
-0.5008620243619921,-3.80180448350988,mirror,https://www.mirror.co.uk/news/uk-news/brit-family-14-among-thousands-21570731,brit family-of-14 among thousands stranded as canary islands sandstorm grounds flights
-3.6250566389417536,4.11583743611181,bbc,https://www.bbc.co.uk/news/uk-england-51630430,canary islands sandstorm: stranded tourists 'devastated'
-2.2835298531992727,0.630503983733121,metro,https://metro.co.uk/2020/02/23/travel-chaos-brits-stranded-canary-islands-amid-saharan-sandstorm-12289477/,travel chaos as brits stranded in canary islands amid saharan sandstorm
6.365904139273995,2.3291123216685214,independent,https://www.independent.co.uk/news/world/europe/canary-islands-sandstorm-tenerife-calima-sahara-wildfire-a9353406.html,canary islands engulfed by huge saharan sandstorm
0.42185358833398445,-2.0116136822950317,independent,https://www.independent.co.uk/news/world/europe/canary-islands-sandstorm-flight-cancelled-uk-sahara-gran-canaria-lanzarote-a9354006.html,canary islands: ‘absolute chaos’ for british tourists after saharan sandstorm swallows holiday resorts
1,1,"Canary, Sandstorm, Saharan, Islands, Stranded"
