income,grades,district,url,headline
-2.9889977073538043,-1.7468107784640698,theguardian,https://www.theguardian.com/world/2020/feb/01/coronavirus-two-uk-york-university-student,york university student is one of two in uk to test positive for coronavirus
-2.5474871015196605,-0.20540545362733487,metro,https://metro.co.uk/2020/02/01/university-student-among-two-people-uk-tested-positive-coronavirus-12164844/,university student among two people in uk who tested positive for coronavirus
-0.11876178624070782,3.7256028141493878,mirror,https://www.mirror.co.uk/news/uk-news/breaking-coronavirus-first-uk-victim-21407507,coronavirus: first uk victim who tested positive confirmed as university of york student
-3.7739011020543924,-2.13127153290246,independent,https://www.independent.co.uk/news/uk/home-news/coronavirus-uk-york-university-student-virus-outbreak-a9312606.html,coronavirus: university of york student named as one of confirmed uk patients
7.299827479606361,-2.728413450345013,bbc,https://www.bbc.co.uk/news/health-51337400,coronavirus: uk patient is university of york student
2.129320217562205,3.0862984011894934,metro,https://metro.co.uk/2020/02/01/york-university-students-now-positive-coronavirus-test-12165541/,what should york university students do now after positive coronavirus test?
1,1,"University, Coronavirus, Student, York, Positive"
