income,grades,district,url,headline
-2.0616605130057066,0.8633467974398294,sky,http://news.sky.com/story/coronavirus-outbreak-declared-global-public-health-emergency-11922074,coronavirus outbreak declared global public health emergency by who
5.24307610747138,-0.9728574823239605,independent,https://www.independent.co.uk/news/business/analysis-and-features/coronavirus-china-outbreak-economy-latest-wuhan-virus-a9303216.html,coronavirus: how will the outbreak affect the global economy?
5.01307256117669,3.7136563982415742,theguardian,https://www.theguardian.com/world/2020/jan/30/who-declares-coronavirus-a-global-health-emergency,who declares coronavirus a global health emergency
-2.440017644668171,1.0486915959738272,sun,https://www.thesun.co.uk/news/10858409/coronavirus-outbreak-world-health-organisation/,coronavirus outbreak declared a global public health emergency ‘on an unprecedented scale’ by world health org
-4.129549255760293,3.5797319566739847,independent,https://www.independent.co.uk/news/health/coronavirus-global-emergency-who-china-virus-outbreak-wuhan-latest-a9310441.html,coronavirus: who declares international health emergency over 'unprecedented outbreak'
3.5439305342026737,-2.3709337834553446,sky,http://news.sky.com/story/coronavirus-virologist-reveals-the-science-behind-fight-to-find-vaccine-for-global-outbreak-11922559,coronavirus: virologist reveals the science behind fight to find vaccine for global outbreak
-3.9857987576044773,-2.5236571417637763,bbc,https://www.bbc.co.uk/news/world-51318246,coronavirus declared global health emergency by who
-1.183053031812095,-3.3379783407861345,independent,https://www.independent.co.uk/news/health/coronavirus-latest-who-emergency-outbreak-uk-risk-infections-a9310546.html,"coronavirus: who declares ‘unprecedented outbreak’ a global emergency as more than 9,000 infected"
1,1,"Coronavirus, Global, Outbreak, Emergency, Health"
