income,grades,district,url,headline
6.81778943961842,1.74997646419437,independent,https://www.independent.co.uk/news/world/americas/coronavirus-trump-deborah-birx-white-house-press-briefing-social-distancing-a9444931.html,coronavirus: trump publicly undermines chief doctor’s plea for better social distancing
-2.7466713182201383,0.5939377984485648,independent,https://www.independent.co.uk/news/world/americas/coronavirus-social-distancing-when-end-white-house-update-trump-us-government-a9456076.html,coronavirus: white house looking into whether social distancing can be relaxed after april
-3.93033881994059,-2.109120608152934,bbc,https://www.bbc.co.uk/news/uk-england-london-52129492,"coronavirus: social distancing plea by family after boy, 13, died"
4.048006160690605,-3.6229904353649216,bbc,https://www.bbc.co.uk/news/world-52198508,coronavirus: how do you celebrate a religious festival while social distancing?
-1.3240067662407677,3.753406784613609,sky,http://news.sky.com/story/coronavirus-social-distancing-may-have-already-reduced-infection-rate-11967734,coronavirus: social distancing may have already reduced infection rate
-2.8647786959075323,-0.3652100037386892,sun,https://www.thesun.co.uk/news/11316636/oann-white-house-distancing-coronavirus-chanel-rion/,right-wing outlet kicked out of trump briefings for ignoring social distancing rules
1,1,"Distancing, Social, Coronavirus"
