income,grades,district,url,headline
-4.688899984215611,1.7683256261123976,theguardian,https://www.theguardian.com/business/2020/jan/23/unions-agree-deal-to-sell-british-steel-to-chinese-firm-jingye,unions agree terms over sale of british steel to chinese firm jingye
0.26147951569730166,-1.5775957454110194,sky,http://news.sky.com/story/british-steel-up-to-500-jobs-to-go-as-unions-strike-deal-with-chinas-jingye-11916752,british steel: up to 500 jobs to go as unions strike deal with china's jingye
4.796070088971588,4.133489169458542,mirror,https://www.mirror.co.uk/news/politics/unions-back-chinese-deal-british-21352285,unions back chinese deal for british steel - but 500 jobs could be axed
-2.6055829743446424,1.0867267621618566,bbc,https://www.bbc.co.uk/news/business-51233449,"british steel: jingye deal could mean 500 job cuts, unions say"
-0.13609665531166446,-1.8139382150560048,bbc,https://www.bbc.co.uk/news/business-51255444,british steel: rival bidder on standby if jingye sale fails
2.3730300092030276,-3.597007597265773,independent,https://www.independent.co.uk/news/business/news/british-steel-job-losses-takeover-jingye-collapse-liquidation-bchapman-318-pm-a9300541.html,british steel: up to 500 job losses expected despite chinese firm jingye agreeing takeover deal
1,1,"British, Steel, Jingye, Unions, Sale"
