income,grades,district,url,headline
8.544066502412107,-3.0380742602829023,independent,https://www.independent.co.uk/news/world/americas/coronavirus-new-york-hospital-ventilator-supplies-shortage-us-patients-a9431486.html,coronavirus: new york hospital forced to use one ventilator on two patients
-3.5282035523247206,-2.4974013571548648,independent,https://www.independent.co.uk/news/world/americas/us-politics/coronavirus-new-york-cases-death-toll-hospital-beds-how-many-wait-a9427911.html,coronavirus: new york hospital suffers 13 deaths in a day as patients die waiting for beds
1.9682044825404694,5.384117360518829,dailymail,https://www.dailymail.co.uk/news/article-8153111/Chicago-uses-hotels-quarantine-coronavirus-patients-New-York-considers-similar-plan.html,chicago uses hotels to quarantine coronavirus patients to ease hospital demand as new york considers a similar option in addition to its converted 1000-bed convention center
-2.9194247739606722,-0.6672991236290234,sun,https://www.thesun.co.uk/news/11301063/shocking-video-shows-coronavirus-patients-treated-in-corridors-of-war-zone-new-york-hospital-as-deaths-soar-past-1000/,shocking video shows coronavirus patients treated in corridors of ‘war zone’ new york hospital as deaths soar
-2.9160378258656863,-0.6687927130928093,sun,https://www.thesun.co.uk/news/11301063/video-coronavirus-patients-corridors-war-zone-new-york-hospital-deaths-1000/,shocking video shows coronavirus patients treated in corridors of ‘war zone’ new york hospital as deaths soar
-1.8470265952934863,-0.6332488705086932,mirror,https://www.mirror.co.uk/news/uk-news/first-look-inside-vast-new-21780937,"first look inside vast new coronavirus hospital built to care for 4,000 patients"
0.6984217624919871,2.1206989641494607,dailymail,https://www.dailymail.co.uk/health/article-8157185/New-York-splitting-ventilators-converting-anesthesia-machines-coronavirus-patients.html,new york is putting two coronavirus patients on one ventilator and making them out of anesthesia machines as cuomo warns patients could be on them for 21 days
1,1,"Patients, Coronavirus, Hospital, York, Deaths"
