income,grades,district,url,headline
0.9961057795846524,-3.021361175649211,independent,https://www.independent.co.uk/news/health/coronavirus-testing-uk-cases-nhs-patients-update-a9409231.html,"coronavirus: nhs to test 25,000 hospital patients a day for covid-19"
-1.6849639181714158,-1.6124464768204672,sky,http://news.sky.com/story/coronavirus-two-nhs-medics-on-ventilators-after-contracting-covid-19-from-patients-11961531,coronavirus: two nhs medics on ventilators after contracting covid-19 from patients
-2.244568784021816,2.1111777632014053,bbc,https://www.bbc.co.uk/news/uk-scotland-51896052,coronavirus: hospital acute beds to double to cope with covid-19
-2.901947921586296,2.7415466216683235,mirror,https://www.mirror.co.uk/news/uk-news/coronavirus-two-nhs-medics-ventilators-21734953,coronavirus: two nhs medics on ventilators after treating covid-19 patients
-1.0522329284867307,-0.23025982921799212,sky,http://news.sky.com/story/coronavirus-take-back-private-hospital-beds-for-covid-19-patients-labour-tells-pm-11957476,"coronavirus: take back private hospital beds for covid-19 patients, labour tells pm"
2.983611561078291,-1.5020865228640519,independent,https://www.independent.co.uk/news/health/coronavirus-deaths-milton-keynes-university-hospital-patients-covid-19-a9408741.html,coronavirus: two patients die at same hospital after contracting covid-19
-0.8526896081914669,-1.78765659026041,sky,http://news.sky.com/story/coronavirus-nhs-to-buy-up-private-hospital-beds-as-covid-19-spreads-in-uk-11957691,coronavirus: nhs to buy up private hospital beds as covid-19 spreads in uk
4.756685819794779,3.3010862099423988,independent,https://www.independent.co.uk/news/health/coronavirus-uk-cases-intensive-care-nhs-northwick-park-a9414311.html,coronavirus: nhs hospital’s intensive care unit overwhelmed by covid-19 outbreak
1,1,"Coronavirus, Covid-19, Hospital, Patients, Nhs"
