income,grades,district,url,headline
-2.378311573289439,-1.193992976721949,independent,https://www.independent.co.uk/news/uk/home-news/david-bellamy-dead-tv-presenter-nature-conservation-foundation-a9243006.html,david bellamy dead: naturalist and broadcaster dies aged 86
5.419781009887233,1.0619865699166648,mirror,https://www.mirror.co.uk/news/uk-news/breaking-tv-nature-presenter-david-21076587,iconic tv presenter and naturalist david bellamy dies aged 86
-2.4184610049411828,0.17826082147765723,theguardian,https://www.theguardian.com/tv-and-radio/2019/dec/11/tv-naturalist-david-bellamy-dies-aged-86,tv naturalist david bellamy dies aged 86
1.582969150302417,-2.663721354655376,bbc,https://www.bbc.co.uk/news/uk-50752089,naturalist and presenter david bellamy dies at 86
-0.9235017524047188,-1.6460194117251372,sky,http://news.sky.com/story/david-bellamy-naturalist-and-broadcaster-dies-11884072,david bellamy: naturalist and broadcaster dies age 86
-1.2824758295543097,4.263486351708141,metro,https://metro.co.uk/2019/12/11/iconic-tv-nature-presenter-david-bellamy-dies-age-86-11769700/,iconic tv nature presenter david bellamy dies age 86
1,1,"Bellamy, Dies, Naturalist, Aged, Iconic"
