income,grades,district,url,headline
-3.2847055874571383,2.855394767227906,theguardian,https://www.theguardian.com/politics/2020/mar/23/alex-salmond-acquitted-of-all-charges-in-sexual-assault-trial,alex salmond acquitted of all charges in sexual assault trial
0.17582070779442205,-3.3780260152935977,sky,http://news.sky.com/story/alex-salmond-trial-scotlands-former-first-minister-acquitted-of-all-sexual-assault-charges-11962184,alex salmond trial: scotland's former first minister acquitted of all sexual assault charges
5.576020831446873,4.007943608140483,sun,https://www.thesun.co.uk/news/7091659/alex-salmond-wife-allegations-sexual-misconduct/,who is alex salmond and what was the verdict from his sexual assault trial?
3.2175841815457615,-3.021174406653113,mirror,https://www.mirror.co.uk/news/politics/breaking-alex-salmond-acquitted-sexual-21740076,alex salmond acquitted of all sexual offences against nine women
-0.7134475584264384,-1.165334944030627,bbc,https://www.bbc.co.uk/news/uk-scotland-52004285,alex salmond cleared of all sexual assault charges
-4.971272574903482,0.7011969906089466,theguardian,https://www.theguardian.com/uk-news/2020/mar/20/alex-salmond-jury-retires-to-consider-sexual-assault-verdicts,alex salmond jury retires to consider sexual assault verdicts
1,1,"Salmond, Alex, Sexual, Assault, Trial"
