income,grades,district,url,headline
-2.3615474835421493,4.127104410112737,sun,https://www.thesun.co.uk/news/11260242/coronavirus-cases-uk-how-to-track-spread-app-web/,how many coronavirus cases in the uk? how to track the spread
-2.092992782397881,-1.3069381056726885,theguardian,https://www.theguardian.com/world/2020/apr/04/sharp-rise-recorded-for-coronavirus-cases-in-some-uk-regions,sharp rise recorded for coronavirus cases in some uk regions
-0.6325950358069966,-2.383286283800549,sky,http://news.sky.com/story/coronavirus-new-british-made-ventilators-to-arrive-in-hospitals-next-week-11966463,coronavirus cases 'plateau' in uk as ventilators near production
7.3396576299620815,0.6884745298893885,metro,https://metro.co.uk/2020/04/04/uk-coronavirus-cases-stabilising-nhs-warns-no-room-complacency-12509217/,uk coronavirus cases are stabilising but nhs warns ‘no room for complacency’
-0.5805124001858413,-1.311487512425371,mirror,https://www.mirror.co.uk/news/politics/china-coronavirus-cases-could-40-21773859,china coronavirus cases could be '40 times higher' as uk calls for beijing 'reckoning'
-1.6720099280292093,0.18613296189647993,theguardian,https://www.theguardian.com/world/2020/mar/30/coronavirus-uk-spread-shows-early-signs-of-slowing-key-adviser,coronavirus: uk spread shows early signs of slowing – key adviser
1,1,"Coronavirus, Cases, Spread"
