income,grades,district,url,headline
-3.1694692218016343,1.76588429836289,independent,https://www.independent.co.uk/news/uk/home-news/coronavirus-uk-cases-death-toll-nhs-delay-phase-boris-johnson-cobra-latest-a9397286.html,coronavirus: uk cases soar to 590 as death toll grows
-3.052439401469958,1.842862281481207,sky,http://news.sky.com/story/coronavirus-uk-tracker-how-many-cases-are-in-your-area-8211-updated-daily-11956258,coronavirus uk tracker: how many cases are in your area – updated daily
10.321686056061147,8.353842169773923,bbc,https://www.bbc.co.uk/news/uk-51812326,coronavirus: uk tactics defended as cases expected to rise
3.050475274829714,-1.751304424033201,mirror,https://www.mirror.co.uk/news/politics/uk-already-55000-coronavirus-cases-21707938,"uk may already have 55,000 coronavirus cases - and can expect 20,000 deaths"
-0.9245193081041144,-1.2579434934122433,metro,https://metro.co.uk/2020/03/07/number-uk-coronavirus-cases-jumps-42-206-12363400/,number of uk coronavirus cases jumps by 42 to 206
-3.134421142537493,2.075929181784349,metro,https://metro.co.uk/2020/03/11/number-uk-coronavirus-cases-jumps-83-456-12381801/,number of uk coronavirus cases jumps by 83 to 456
2.2853764057334334,-2.086727384835039,sky,http://news.sky.com/story/coronavirus-ten-more-die-after-positive-diagnosis-11957525,"coronavirus: ten more die in uk as cases top 1,100"
-2.8633543307904286,1.4843775161574595,metro,https://metro.co.uk/2020/03/12/number-uk-coronavirus-cases-jumps-134-590-12387839/,number of uk coronavirus cases jumps by 134 to 590
3.3371314940536583,-2.085345980360924,metro,https://metro.co.uk/2020/03/17/another-14-people-dead-coronavirus-taking-death-toll-71-12410786/,uk coronavirus death toll reaches 71 after another 14 die
-3.192935940298653,2.5408800871012747,theguardian,https://www.theguardian.com/world/2020/mar/16/coronavirus-uk-cases-how-many-are-in-your-area-covid-19,coronavirus uk cases: find out how many are in your area
4.863884943546678,-1.0629203070877338,mirror,https://www.mirror.co.uk/news/uk-news/breaking-coronavirus-uk-cases-rise-21680315,coronavirus: two more uk patients die as cases soar by 134 to 590
-0.4608013782851855,-2.2203222114581127,mirror,https://www.mirror.co.uk/news/uk-news/breaking-coronavirus-uk-cases-soar-21654277,coronavirus uk cases soar to 273 in biggest jump so far with 64 more diagnosed
-3.2008943206379423,3.377570496255431,sun,https://www.thesun.co.uk/news/11085950/coronavirus-uk-live-cases-updates/,coronavirus live: uk cases rise above 200 – latest updates
0.15170426700765843,-2.849067499415067,mirror,https://www.mirror.co.uk/news/uk-news/breaking-coronavirus-uk-cases-soar-21686938,coronavirus uk cases soar as 208 more patients diagnosed taking total to 798
-2.644704622038498,0.618523207439099,mirror,https://www.mirror.co.uk/news/uk-news/breaking-coronavirus-uk-14-more-21695920,"coronavirus uk: 14 more patients die as confirmed cases soar to 1,372"
3.839932012341834,-2.664520645818148,independent,https://www.independent.co.uk/news/health/coronavirus-uk-cases-symptoms-deaths-covid-19-nhs-a9390346.html,coronavirus: uk sees second largest day-on-day increase in cases
-3.021423782542162,1.65045242187306,independent,https://www.independent.co.uk/news/uk/home-news/coronavirus-uk-cases-infections-nhs-outbreak-latest-a9387751.html,coronavirus: uk cases rise to 319
-2.9236077865876284,1.7001447814931925,metro,https://metro.co.uk/2020/03/09/number-uk-coronavirus-cases-rises-46-319-12371425/,number of uk coronavirus cases rises by 46 to 319
4.394366119297809,-2.2308532847942266,mirror,https://www.mirror.co.uk/news/uk-news/breaking-coronavirus-uk-cases-soar-21692125,"coronavirus uk cases soar as 342 more patients diagnosed taking total to 1,140"
2.1157178631483173,-2.5787866748308854,independent,https://www.independent.co.uk/news/uk/home-news/coronavirus-uk-cases-nhs-covid-19-pandemic-latest-a9400176.html,coronavirus uk: number of cases rises to 798 in biggest single-day surge
9.708036136486555,4.856748146610981,mirror,https://www.mirror.co.uk/news/uk-news/breaking-coronavirus-uk-cases-rise-21700326,"coronavirus uk: cases rise to 1,543 as 171 more patients test positive"
-1.610472655081776,-0.8808625428653645,independent,https://www.independent.co.uk/news/health/coronavirus-uk-cases-number-206-locations-latest-a9384586.html,coronavirus cases in uk rise to 206 today
0.1807542435738208,-2.1493650902531383,bbc,https://www.bbc.co.uk/news/uk-51784498,coronavirus cases in uk pass 200
-0.3019201198987682,-1.595378581928268,sky,http://news.sky.com/story/coronavirus-42-more-cases-in-uk-taking-total-to-206-11951800,"coronavirus: 42 more cases in uk, taking total to 206"
0.07968498073509192,-1.8420976489624605,bbc,https://www.bbc.co.uk/news/health-51915302,coronavirus: uk changes course amid death toll fears
-0.5515248209513268,-1.4670958133276708,sun,https://www.thesun.co.uk/news/11171721/brit-scientist-on-brink-vaccine/,brit scientist on brink of developing coronavirus vaccine as uk cases soar to 798
-0.8070194643743843,-1.9669803109217354,independent,https://www.independent.co.uk/news/uk/home-news/coronavirus-uk-death-toll-cases-update-today-latest-news-a9403206.html,"coronavirus: uk death toll reaches 35, with more than 200 new patients testing positive"
3.0690865128085183,-2.4784659652255057,sun,https://www.thesun.co.uk/news/11182768/coronavirus-cases-total-britain-uk-virus/,"thirty more coronavirus cases in uk takes total to 1,421 as bug sweeps britain"
-1.7152280435821627,-0.6479495889194944,metro,https://metro.co.uk/2020/03/10/italys-coronavirus-death-toll-rises-631-10000-cases-confirmed-12378088/,"italy’s coronavirus death toll rises to 631 with more than 10,000 cases confirmed"
0.19113455680367195,-1.729933623528335,independent,https://www.independent.co.uk/news/world/europe/coronavirus-italy-death-toll-covid-19-pandemic-france-spain-europe-a9403296.html,"coronavirus: italy death toll rises to more than 1,800"
-2.9667606601804812,1.91140936686272,metro,https://metro.co.uk/2020/03/13/first-person-dies-coronavirus-scotland-bringing-uk-death-toll-11-12394975/,first person dies of coronavirus in scotland bringing uk death toll to 11
-1.277689354541299,-1.3596776173691174,independent,https://www.independent.co.uk/news/health/coronavirus-news-italy-deaths-rise-outbreak-latest-map-a9391861.html,coronavirus death toll in italy rises to 631 in biggest single day jump
-3.5480338128672995,4.012199781970112,independent,https://www.independent.co.uk/news/health/coronavirus-uk-death-toll-update-covid-19-cases-today-matt-hancock-a9405086.html,coronavirus: uk death toll rises to 53
-1.6713484022075016,-0.515104235531811,independent,https://www.independent.co.uk/news/uk/home-news/uk-coronavirus-death-toll-nhs-latest-outbreak-pandemic-a9407311.html,uk coronavirus death toll rises to 71
-2.094268298250988,-0.275957353423736,metro,https://metro.co.uk/2020/03/11/italys-death-toll-coronavirus-soars-196-just-24-hours-12383964/,italy’s death toll from coronavirus soars by 196 in just 24 hours
7.0321289824613675,2.3792404931114515,sun,https://www.thesun.co.uk/news/11142710/coronavirus-italy-168-deaths/,"coronavirus – italy sees highest one-day death toll as 168 die and cases tops 10,000"
-2.263217877080969,0.2990130867028025,mirror,https://www.mirror.co.uk/news/uk-news/coronavirus-uk-death-toll-doubles-21693772,uk coronavirus deaths by area as death toll doubles in a day
-3.037036991243658,2.170592855854657,metro,https://metro.co.uk/2020/03/12/coronavirus-death-toll-hits-1000-italy-four-weeks-ahead-uk-12390101/,"coronavirus death toll hits 1,000 in italy which is four weeks ahead of uk"
-2.121572540967576,-0.1287882293878428,metro,https://metro.co.uk/2020/03/11/eighth-person-uk-dies-coronavirus-12384242/,two more people die from coronavirus as uk death toll reaches eight
-1.1747521976973019,-1.0820268045895853,metro,https://metro.co.uk/2020/03/16/wales-confirms-first-death-coronavirus-cases-hit-124-12405279/,wales confirms its first death from coronavirus as cases hit 124
-0.3712068063676301,-1.8199443828892614,sun,https://www.thesun.co.uk/news/11178008/coronavirus-spain-deaths-infected/,"spain coronavirus death toll doubles overnight to 288 as number of cases surge to almost 8,000 cases"
-3.1853376307235113,1.9276510027912936,mirror,https://www.mirror.co.uk/news/uk-news/breaking-coronavirus-uk-death-toll-21692582,coronavirus: uk death toll doubles overnight bringing total dead to 21
-3.2039399010245515,2.4105088478612418,independent,https://www.independent.co.uk/news/health/coronavirus-uk-death-toll-cases-nhs-today-update-a9402236.html,"coronavirus: uk death toll nearly doubles in one day to 21, as more than 1,000 test positive"
0.661994027769855,-2.090139607475362,sun,https://www.thesun.co.uk/news/11161576/italy-deaths-1000/,"italy coronavirus death toll jumps by 23% in a day to 1,016 – as country has 15,000 confirmed cases"
-0.6200457165036234,-2.2805918504651546,mirror,https://www.mirror.co.uk/news/uk-news/coronavirus-uk-death-toll-hits-21697589,coronavirus uk death toll hits 35 as nhs confirms areas where patients died
5.3851405772100325,-0.3548989132225833,sun,https://www.thesun.co.uk/news/11154141/britain-given-up-fight-coronavirus/,boris johnson to declare britain has given up fight to ‘contain’ coronavirus as uk death toll rises to eig
-1.5292692237356482,-0.883496935533391,metro,https://metro.co.uk/2020/03/12/two-dead-uk-infected-coronavirus-taking-toll-10-12388515/,two more dead in uk after being infected by coronavirus taking toll to 10
-1.3284840828396423,-0.7089035882797091,independent,https://www.independent.co.uk/news/health/coronavirus-uk-death-toll-covid-19-symptoms-cases-latest-a9395661.html,coronavirus: uk death toll rises to eight as two more patients killed by disease
3.2371207293406634,-2.4660719711019237,sun,https://www.thesun.co.uk/news/11123405/italy-quarantines-16-million-coronavirus/,"coronavirus: italy death toll soars by 133 with 1,500 new cases in a day as 16million people put in quarantine"
5.329699461382859,1.0061767519180471,mirror,https://www.mirror.co.uk/news/uk-news/coronavirus-uk-latest-official-advice-21669054,coronavirus uk: latest official advice as uk death toll rises to six with 373 cases
-1.9607840326861488,-0.27971793990974625,independent,https://www.independent.co.uk/news/world/europe/coronavirus-spain-cases-death-toll-double-latest-news-a9403126.html,"coronavirus death toll in spain more than doubles in a day as cases near 8,000"
-3.3065707766927375,3.4072337257515835,independent,https://www.independent.co.uk/news/world/asia/china-hotel-collapse-coronavirus-quarantine-death-toll-missing-quangzhou-a9385136.html,china hotel collapse: death toll from coronavirus quarantine disaster rises to 10
1,1,"Coronavirus, Cases, Toll, Death"
