income,grades,district,url,headline
-0.923988198213735,3.7408960788173347,sky,http://news.sky.com/story/donald-trump-says-large-scale-coronavirus-testing-will-take-place-in-us-11956921,coronavirus: donald trump says 'large scale' testing will take place in us
-3.085177484410818,-3.163583030725892,independent,https://www.independent.co.uk/news/world/americas/trump-coronavirus-test-positive-covid-19-infected-latest-a9401761.html,trump says 'i will most likely get tested' for coronavirus having initially said he would not
-2.5466911020552745,-0.38890913036129265,independent,https://www.independent.co.uk/news/world/americas/trump-coronavirus-test-news-update-today-symptoms-a9402471.html,trump says he has been tested for coronavirus
9.944793046749375,-2.1551843958287638,dailymail,https://www.dailymail.co.uk/news/article-8118521/Donald-Trump-says-economy-recession.html,donald trump says the economy 'may be' in a recession as he predicts the coronavirus crisis could last through august
-2.9677072982369768,-3.5160441094091808,metro,https://metro.co.uk/2020/03/18/donald-trump-says-border-us-canada-closed-contain-coronavirus-12418320/,donald trump closes border between us and canada to contain coronavirus
-1.6851199051118113,1.0937640442134182,independent,https://www.independent.co.uk/news/world/americas/coronavirus-vaccine-trump-us-cases-germany-carevac-a9403646.html,"trump administration tried to buy coronavirus vaccine ‘only for the us’, report says"
1.2638909412792445,4.389060543294373,bbc,https://www.bbc.co.uk/news/world-us-canada-51860529,"coronavirus: us 'failing' on testing, says anthony fauci"
1,1,"Coronavirus, Says, Testing, Trump, Donald"
