income,grades,district,url,headline
7.699569720918968,-2.0656627082286945,independent,https://www.independent.co.uk/news/uk/politics/iran-crisis-boris-johnson-trump-soleimani-corbyn-commons-quds-a9275336.html,iran crisis: boris johnson gives strongest backing yet to trump over us killing of soleimani
0.7261502926819668,3.9122323527637093,independent,https://www.independent.co.uk/news/world/americas/trump-soleimani-killing-iran-speech-revenge-warning-regime-change-latest-a9269921.html,trump says us not seeking regime change in iran but warns against retaliation for soleimani killing
-2.8808557217495885,-3.08536491057015,sun,https://www.thesun.co.uk/news/10708031/iran-general-killing-trump-avenge-soleimani/,iran general warns even killing trump won’t avenge soleimani and ‘a tsunami will sweep away all us bases’ in m
-1.3442087471258475,2.6127071337535357,independent,https://www.independent.co.uk/news/uk/politics/iran-war-nazanin-zaghari-ratcliffe-richard-soleimani-boris-johnson-trump-a9271936.html,iran crisis: richard ratcliffe demands meeting with boris johnson over wife nazanin's 'desperate' situation after soleimani killing
-0.9085716107578428,1.3275974213607167,mirror,https://www.mirror.co.uk/news/politics/iran-crisis-ambassador-claims-killing-21252248,iran crisis: us ambassador claims killing qassem soleimani was an act of peace
-3.2920839339676573,-2.701509289079118,independent,https://www.independent.co.uk/news/uk/politics/iran-news-war-boris-johnson-trump-where-is-holiday-a9271456.html,"boris johnson finally breaks silence on iran crisis with call for calm, but adds 'we will not lament' soleimani death"
1,1,"Soleimani, Iran, Killing, Crisis, Boris"
