income,grades,district,url,headline
6.638711827210003,3.8643836176051023,theguardian,https://www.theguardian.com/world/2020/feb/01/coronavirus-travel-bans-plunge-china-into-deepening-isolation,travel bans plunge china into deepening isolation over coronavirus
-0.03077966468876703,-2.6611549636222747,bbc,https://www.bbc.co.uk/news/uk-51288672,coronavirus: foreign office warns against 'all but essential travel' to china
-0.839228053733257,-2.560349098825146,bbc,https://www.bbc.co.uk/news/business-51276316,coronavirus: facebook staff told to avoid china travel
-4.565659406966833,4.084737930125639,bbc,https://www.bbc.co.uk/news/uk-northern-ireland-51343599,coronavirus: queen's university stop travel to china
-4.273189313730788,0.11731091121269624,theguardian,https://www.theguardian.com/business/2020/jan/28/global-firms-halt-china-travel-as-coronavirus-spooks-markets,global firms halt china travel as coronavirus spooks markets
3.070144611909639,-2.8449283964960173,sky,http://news.sky.com/story/china-facing-global-isolation-as-number-dead-from-coronavirus-rises-to-304-11924374,china facing global isolation as number dead from coronavirus rises to 304
1,1,"China, Coronavirus, Travel, Isolation, Global"
