income,grades,district,url,headline
-0.2570372421900387,4.980124867055293,sky,http://news.sky.com/story/hong-kong-polls-open-with-results-to-show-scale-of-pro-democracy-support-11868775,hong kong: record turnout in elections seen as poll on pro-democracy protests
10.78160218079203,-2.0040724802599224,theguardian,https://www.theguardian.com/world/2019/nov/24/hong-kong-protests-prompt-huge-turnout-for-local-elections,hong kong: protests prompt huge turnout for local elections
-3.5786952075630922,-2.7998612638780567,sky,http://news.sky.com/story/hong-kong-council-elections-pro-democracy-candidates-make-big-gains-11869659,hong kong council elections: pro-democracy candidates make big gains
-0.21984431690216727,3.898020360599686,independent,https://www.independent.co.uk/news/world/asia/hong-kong-elections-record-turnout-pro-democracy-protests-china-result-latest-a9215501.html,hong kong elections: record numbers turn out to vote as pro-democracy protesters hope to send message to china
-3.3373390613789846,-1.5955570089998032,independent,https://www.independent.co.uk/news/world/asia/hong-kong-election-results-district-council-democracy-protests-carrie-lam-china-a9216326.html,hong kong election: pro-democracy candidates make stunning gains after record turnout
-3.3886863527577464,-2.4786544745171946,dailymail,https://www.dailymail.co.uk/news/article-7697099/Hong-Kongs-anti-mask-law-unconstitutional-high-court-rules.html,"hong kong's anti-mask law aiming to quash pro-democracy protests is 'unconstitutional', high court rules"
1,1,"Pro-Democracy, Kong, Turnout, Elections, Protests"
