income,grades,district,url,headline
5.52007090386574,0.2004052835229149,mirror,https://www.mirror.co.uk/news/uk-news/firms-refurbishing-grenfell-tower-knew-21381695,firms refurbishing grenfell tower knew cladding would fail if a fire broke out
-0.6350010499342863,-2.3525296610887056,independent,https://www.independent.co.uk/news/uk/home-news/grenfell-tower-fire-inquiry-hearing-cladding-insulation-rydon-harley-facades-studio-e-exova-a9306191.html,"grenfell tower firms knew planned cladding would fail in fire, emails suggest"
-0.23013113302695265,-1.8124407573955255,metro,https://metro.co.uk/2020/01/28/devastating-emails-show-firms-refurbishing-grenfell-knew-cladding-dangerous-12140133/,devastating emails show firms refurbishing grenfell ‘knew cladding was dangerous’
4.822730709669084,0.7073159981700068,bbc,https://www.bbc.co.uk/news/uk-51313349,grenfell tower inquiry: firms 'pulled the trigger' on victims
-2.237403929606546,-0.17753111131907828,bbc,https://www.bbc.co.uk/news/uk-51279906,grenfell tower fire: firms 'knew cladding would fail in fire'
-2.105222665189664,4.680253162769103,dailymail,https://www.dailymail.co.uk/news/article-7947269/Grenfell-Tower-cladding-firms-responsible-72-fire-deaths.html,"grenfell tower cladding firms are responsible for 72 fire deaths 'as sure as if they had taken careful aim with a gun and pulled the trigger', victims' lawyer tells blaze inquiry"
-2.123622922569744,-0.8146902089147732,sky,http://news.sky.com/story/grenfell-disaster-firms-which-refurbished-tower-knew-cladding-would-be-fire-risk-11920116,grenfell disaster: firms which refurbished tower 'knew cladding would be fire risk'
-3.011419913207631,-0.4307827057439441,sky,http://news.sky.com/story/grenfell-manufacturer-warned-fire-would-race-up-cladding-11921661,grenfell: manufacturer warned fire would 'race up' cladding
1,1,"Grenfell, Cladding, Firms, Fire, Tower"
