income,grades,district,url,headline
-3.829323682662868,-1.18124431344759,theguardian,https://www.theguardian.com/tv-and-radio/2020/feb/16/caroline-flack-boyfriend-lewis-burton-heartbroken-by-her-death-love-island,caroline flack's boyfriend lewis burton 'heartbroken' by her death
-4.154362324228308,0.6593681487081585,sky,http://news.sky.com/story/caroline-flack-boyfriend-lewis-burton-sent-i-love-you-valentines-message-before-her-death-11935269,caroline flack: boyfriend lewis burton sent 'i love you' valentine's message before her death
-1.6351333299628417,2.161291701595567,sun,https://www.thesun.co.uk/tvandshowbiz/10973668/caroline-flack-boyfriend-lewis-burton-instagram-post/,caroline flack’s boyfriend lewis burton says he’s ‘in so much pain’ as he pays tribute to star after her suici
-4.017086230484993,-2.4128798348780016,metro,https://metro.co.uk/2020/02/16/inside-caroline-flack-and-boyfriend-lewis-burtons-relationship-as-he-breaks-silence-over-presenters-death-12247961/,inside caroline flack and boyfriend lewis burton’s relationship as he breaks silence over presenter’s death
5.233031225378813,4.556118920170552,sky,http://news.sky.com/story/i-wasnt-allowed-to-be-there-caroline-flacks-partner-lewis-burton-breaks-silence-11935409,caroline flack death: partner lewis burton makes 'heartbroken' post saying 'i'll be your voice baby'
8.402874341960196,-3.782654622148689,dailymail,https://www.dailymail.co.uk/tvshowbiz/article-8007831/Caroline-Flack-dies-just-one-day-boyfriend-Lewis-Burton-professed-love.html,boyfriend lewis burton sent caroline flack a valentine's day message telling her 'love you' just a day before she was found dead
1,1,"Caroline, Lewis, Burton, Boyfriend, Death"
