income,grades,district,url,headline
-4.486415461555875,0.6855981308003761,metro,https://metro.co.uk/2019/12/06/when-do-universities-break-up-for-christmas-11275630/,when do universities break up for christmas?
3.94351500344103,-2.189548145861273,metro,https://metro.co.uk/2019/12/10/ultimate-guide-get-grandma-christmas-11411474/,the ultimate guide to what to get your grandma this christmas
-4.613259462517462,1.5102144150141477,sun,https://www.thesun.co.uk/dear-deidre/10531835/mum-only-adult-gift-christmas/,i think my mum doesn’t want to buy a christmas present for me anymore as i’m 42
5.568656474380924,4.545904493569665,bbc,https://www.bbc.co.uk/news/business-50662378,how to have a more sustainable christmas
-3.029713749827438,-0.9344614317031791,theguardian,https://www.theguardian.com/stage/2019/dec/10/modern-topical-christmas-cracker-jokes,pull the other one! top 10 modern christmas cracker jokes revealed
2.617217196078823,-3.617707461819738,metro,https://metro.co.uk/2019/12/06/the-ultimate-gift-guide-for-christmas-presents-to-give-to-your-mum-to-gift-guide-for-christmas-presents-for-mum-11282352/,the ultimate gift guide of what to get your mum for christmas
1,1,Christmas
