income,grades,district,url,headline
-4.421625390536855,4.871090885618437,independent,https://www.independent.co.uk/news/uk/crime/joseph-mccann-rape-guilty-attack-women-children-latest-a9235651.html,joseph mccann: serial rapist found guilty of attacks on women and children in 'depraved' kidnapping spree
5.813139942210113,4.143200491698058,mirror,https://www.mirror.co.uk/news/uk-news/breaking-serial-rapist-joseph-mccann-21056076,serial rapist joseph mccann given 33 life sentences for attacks on 11 women and children
2.221226000015739,-1.8930460664585633,metro,https://metro.co.uk/2019/12/09/serial-rapist-given-33-life-sentences-attacks-11-women-children-11418862/,serial rapist given 33 life sentences for attacks on 11 women and children
1.3956449916330749,-2.619920242587,independent,https://www.independent.co.uk/news/uk/crime/joseph-mccann-rape-guilty-attack-prison-life-attack-women-children-latest-a9239011.html,joseph mccann: serial rapist who attacked women and children in kidnapping spree sentenced to life in prison
-0.8528029684462146,-0.6504567640513136,mirror,https://www.mirror.co.uk/news/uk-news/breaking-serial-rapist-joseph-mccann-21039233,rapist joseph mccann guilty of 37 counts of rape and kidnapping of women and children
-0.7741291123374887,-3.1686686161606823,metro,https://metro.co.uk/2019/12/06/serial-rapist-joseph-mccann-found-guilty-string-attacks-11294606/,serial rapist found guilty of raping 11 women and children
-3.381453462538373,-0.6821996880589389,bbc,https://www.bbc.co.uk/news/uk-england-london-50684470,joseph mccann guilty of sex attacks on 11 women and children
1,1,"Women, Children, Rapist, Joseph, Mccann"
