income,grades,district,url,headline
-2.139987139533324,-1.7669840105777466,metro,https://metro.co.uk/2020/03/17/iran-frees-85000-prisoners-stop-spread-coronavirus-12409037/,"iran frees 85,000 prisoners to stop spread of coronavirus"
2.99694944166973,-1.1779507558724107,sky,http://news.sky.com/story/coronavirus-iran-frees-85000-prisoners-to-combat-spread-of-covid-19-11958783,"coronavirus: iran frees 85,000 prisoners to combat spread of infection"
3.103816153718484,-1.0541630400404711,mirror,https://www.mirror.co.uk/news/world-news/breaking-coronavirus-iran-release-85000-21705108,"coronavirus: iran release 85,000 prisoners in bid to tackle spread of virus"
4.764362098919298,4.180590087073966,metro,https://metro.co.uk/2020/03/15/british-prisoners-released-stop-coronavirus-spread-12400611/,british prisoners could be released to stop coronavirus spread
0.4365445513458248,-3.5569018689622998,mirror,https://www.mirror.co.uk/news/uk-news/coronavirus-prisoners-released-early-bid-21697682,coronavirus: prisoners may be released early in bid to stop spread behind bars
-4.451217249246305,2.1428054405745334,metro,https://metro.co.uk/2020/03/16/boris-tells-everyone-stop-contact-unless-essential-stop-coronavirus-spread-12406999/,boris tells everyone to stop all contact unless essential to stop coronavirus spread
-4.710467856873712,1.2326041478044312,dailymail,https://www.dailymail.co.uk/news/article-8111783/British-Iranian-prisoner-reveals-coronavirus-chaos-inside-Irans-prisons.html,"british-iranian prisoner reveals coronavirus chaos inside iran’s prisons despite 54,000 being released to stop the spread"
1,1,"Coronavirus, Spread, Prisoners, Stop, Iran"
