income,grades,district,url,headline
-3.3076212682191124,-0.8413144769096695,bbc,https://www.bbc.co.uk/news/uk-england-51441770,storm ciara: man dies as tree falls on car in hampshire
-0.9383107353579001,-3.248326567426752,bbc,https://www.bbc.co.uk/news/uk-51439152,storm ciara: man dies after tree falls on car during gales
5.3487104880094964,0.6514446564205992,mirror,https://www.mirror.co.uk/news/uk-news/breaking-first-storm-ciara-death-21467069,first storm ciara death as man dies after car is hit by falling tree
-4.1660305750931,4.917983982810961,sky,http://news.sky.com/story/snow-and-ice-set-to-hit-uk-after-storm-ciara-causes-havoc-11930514,uk weather: man dies after tree falls on his car during storm ciara
4.603413626279795,1.4477370680542037,metro,https://metro.co.uk/2020/02/10/storm-ciara-claims-mans-life-tree-falls-onto-mercedes-12214727/,storm ciara claims man’s life after tree falls onto mercedes
-1.5401615356191765,-2.9275246629493417,theguardian,https://www.theguardian.com/uk-news/2020/feb/10/uk-weather-thousands-without-electricity-as-storm-ciara-batters-britain-snow-ice,storm ciara: man dies after tree falls on car
1,1,"Tree, Storm, Ciara, Falls, Man"
