income,grades,district,url,headline
-2.680148681617498,-0.7400380375648073,mirror,https://www.mirror.co.uk/news/uk-news/family-boy-13-who-died-21805750,"family of boy, 13, who died from coronavirus cannot attend funeral over symptoms"
-2.355270031182001,-0.7683821927498454,sun,https://www.thesun.co.uk/news/11300265/sadiq-khan-tribute-boy-13-coronavirus-death/,"family of tragic 13-year-old boy who died of coronavirus ‘will probably never recover’, says sadiq khan"
-0.9410348467938442,-3.306943682568508,sun,https://www.thesun.co.uk/news/11300921/uk-youngest-coronavirus-victim-died-symptoms/,"uk’s youngest coronavirus victim, 13, died just a week after first symptoms as family tells of ‘healthy’ boy’s"
3.5186969515115614,0.1203335625269439,independent,https://www.independent.co.uk/news/uk/home-news/coronavirus-london-ismail-mohamed-abdulwahab-family-funeral-symptoms-a9445156.html,family of london 13-year-old boy killed by coronavirus unable to attend funeral after developing symptoms
-2.5085705125956927,4.099799645158774,mirror,https://www.mirror.co.uk/news/uk-news/heartbreaking-pictures-show-lonely-funeral-21809116,"heartbreaking pictures show lonely funeral of boy, 13, who died from coronavirus"
4.966327120677474,0.5952307051974423,metro,https://metro.co.uk/2020/04/03/family-boy-13-killed-coronavirus-cant-go-funeral-displaying-symptoms-12502850/,"family of boy, 13, killed by coronavirus can’t go to his funeral after displaying symptoms"
1,1,"Coronavirus, Boy, Family, Symptoms, Died"
