income,grades,district,url,headline
-2.675664995210679,1.7169168516053621,independent,https://www.independent.co.uk/news/business/news/beales-administration-jobs-risk-store-closures-kpmg-bust-a9291786.html,"beales department store chain goes into administration, putting 1,050 jobs at risk"
-1.1798901708200071,-1.9451327211914224,mirror,https://www.mirror.co.uk/money/breaking-beales-department-goes-administration-21318002,"beales department stores goes into administration putting 1,000 jobs at risk"
-3.3374672912408245,4.245496619854585,dailymail,https://www.dailymail.co.uk/news/article-7907675/Beales-department-store-goes-administration-closing-22-shops-1-000-jobs-risk.html,"beales department store goes into administration closing 22 branches and putting more than 1,000 jobs at risk"
-2.4124225377782684,-1.0488466263267917,sky,http://news.sky.com/story/department-store-chain-beales-poised-to-decide-on-administration-11912671,department store chain beales poised to decide on administration
0.0120076807933733,-2.5321006759231257,sky,http://news.sky.com/story/department-store-chain-beales-goes-into-administration-11913306,department store chain beales goes into administration
5.6014310914743035,2.5760664344651563,theguardian,https://www.theguardian.com/business/2020/jan/20/beales-administration-full-list-stores-jobs,"beales goes into administration with 22 stores and 1,300 jobs at risk"
-0.06871271742181331,-2.850525804958555,bbc,https://www.bbc.co.uk/news/business-51176418,department store beales collapses into administration
4.060718940203918,-0.161874077525205,sun,https://www.thesun.co.uk/money/10777907/beales-administration-jobs-retail-high-street/,"closing time department store chain beales goes into administration with 22 shops and 1,300 jobs at risk"
1,1,"Administration, Beales, Department, Jobs, Risk"
