income,grades,district,url,headline
0.29042387623493576,-3.9347168754871378,mirror,https://www.mirror.co.uk/money/coronavirus-how-much-you-can-21743751,coronavirus: how much you can be fined for breaking boris johnson's lockdown rules
-5.910569573481944,4.206885803446194,metro,https://metro.co.uk/2020/03/23/coronavirus-uk-lockdown-measures-12445310/,coronavirus uk: is britain now in lockdown and what are the new measures outlined by boris johnson?
6.456501765122154,4.3688903077140635,mirror,https://www.mirror.co.uk/news/politics/breaking-boris-johnsons-coronavirus-speech-21742059,boris johnson's coronavirus speech in full as new lockdown rules come into force
0.0681136304740768,-3.4644172670784252,sun,https://www.thesun.co.uk/news/11211842/boris-says-we-can-send-coronavirus-packing-in-12-weeks-if-we-follow-strict-rules/,boris johnson says we can ‘send coronavirus packing in 12 weeks’ if we follow strict rules
3.2695839798684365,-0.923649704993927,sun,https://www.thesun.co.uk/news/11221271/revealed-the-full-list-of-businesses-coronavirus/,revealed: the full list of businesses ordered to close under boris johnson’s coronavirus lockdown
-4.174053678217656,-0.25299226360077104,mirror,https://www.mirror.co.uk/news/politics/breaking-coronavirus-shuts-uk-brits-21741074,coronavirus shuts uk and brits fined for breaking new lockdown rules
1,1,"Coronavirus, Lockdown, Boris, Rules, Fined"
