income,grades,district,url,headline
1.135169761741503,-2.8054484976608256,metro,https://metro.co.uk/2019/11/12/poland-slams-netflix-rewriting-history-nazi-death-camp-documentary-11082596/,poland slams netflix for ‘rewriting history’ in nazi death camp documentary
-1.5479351731997193,0.8112386549305738,sky,http://news.sky.com/story/poland-demands-netflix-changes-its-nazi-death-camp-documentary-11859742,poland demands netflix changes its nazi death camp documentary
4.558330251347964,2.9160418175938023,independent,https://www.independent.co.uk/news/world/europe/netflix-devil-next-door-poland-prime-minister-holocaust-death-camps-nazi-germany-a9199371.html,poland reacts angrily to netflix nazi death camp documentary
-3.2524333684193367,2.3494362668791586,bbc,https://www.bbc.co.uk/news/world-europe-50380906,poland reacts angrily to netflix nazi death camp documentary
0.6808952893068313,-2.8202994083160706,dailymail,https://www.dailymail.co.uk/news/article-7688229/Netflix-agrees-change-Devil-Door-Polish-PM-complained-Nazi-death-camp-maps.html,netflix agrees to change the devil next door documentary after polish pm accused filmmakers of 'rewriting history' by showing nazi death camps within modern poland's borders
-1.5740267607772387,-0.45096883342663596,dailymail,https://www.dailymail.co.uk/news/article-7672931/Poland-asks-Netflix-make-changes-documentary-Nazi-death-camp-guard.html,polish pm accuses netflix documentary the devil next door of 'rewriting history' by showing nazi death camps within modern poland's borders
1,1,"Nazi, Documentary, Netflix, Death, Poland"
