income,grades,district,url,headline
-3.1599679950775768,1.1591026091622474,metro,https://metro.co.uk/2020/03/18/family-truly-heartbroken-dad-45-becomes-uks-youngest-coronavirus-victim-12415029/,"family ‘truly heartbroken’ as dad, 45, becomes uk’s youngest coronavirus victim"
5.5523127231903056,-3.078209835013359,metro,https://metro.co.uk/2020/03/22/teenager-18-becomes-uks-youngest-coronavirus-victim-12439745/,"teenager, 18, becomes uk’s youngest coronavirus victim"
-3.6030122974241023,-0.8395294805800121,sky,http://news.sky.com/story/coronavirus-45-year-old-father-becomes-youngest-uk-victim-11959390,coronavirus: 45-year-old father becomes youngest uk victim
-2.9752596683155406,-2.2567599599148447,independent,https://www.independent.co.uk/news/uk/home-news/coronavirus-youngest-victim-uk-nick-matthews-age-mary-somerset-avon-police-a9403491.html,coronavirus: wife pays tribute to ‘soulmate’ thought to be uk’s youngest victim
-3.057083613564005,0.28228020101240164,sky,http://news.sky.com/story/coronavirus-wifes-heartbreak-as-soul-mate-becomes-uks-youngest-victim-11958030,coronavirus: wife's heartbreak as 'soul mate' becomes uk's youngest victim
2.0358084711019306,4.026214549765328,theguardian,https://www.theguardian.com/world/2020/mar/16/family-of-manchester-coronavirus-victim-pay-tribute-to-gracious-gentleman,family of manchester coronavirus victim pay tribute to 'gracious gentleman'
5.207202380088991,0.7069019155682407,sun,https://www.thesun.co.uk/news/11181939/heartbroken-widow-uk-youngest-coronavirus-victim/,heartbroken widow of uk’s youngest coronavirus victim cries ‘i just want a hug’ as she’s forced to grieve in i
1,1,"Coronavirus, Victim, ’S, Family, Youngest"
