income,grades,district,url,headline
-0.5065650820144633,4.223986169136259,sun,https://www.thesun.co.uk/tvandshowbiz/4879563/brianne-delcourt-dancing-on-ice-professional-engaged-kevin-kilbane/,who is brianne delcourt and when did the dancing on ice skater meet kevin kilbane?
-2.238938132067733,2.9173363322930355,sun,https://www.thesun.co.uk/tvandshowbiz/10899678/brianne-delcourt-dancing-on-ice-romances-kevin-kilbane-engaged/,how brianne delcourt’s three dancing on ice relationships went wrong before she got engaged to kevin kilbane
-4.082138149043017,-2.8318351498625254,metro,https://metro.co.uk/2020/02/09/dancing-ice-brianne-delcourt-shows-off-engagement-ring-kevin-kilbane-reveals-set-wedding-date-12210240/,dancing on ice: brianne delcourt shows off engagement ring as kevin kilbane reveals they’ve set a wedding date
5.984390748487682,-1.1873498983574386,dailymail,https://www.dailymail.co.uk/tvshowbiz/article-7968845/Dancing-Ices-Kevin-Kilbane-Brianne-Delcourt-ENGAGED.html,moment dancing on ice's kevin kilbane proposes to brianne delcourt by seranading her at a steakhouse after two months of dating... and she said yes!
-4.337782673198148,-2.142386307948795,sun,https://www.thesun.co.uk/tvandshowbiz/10915674/dancing-on-ice-brianne-delcourt-voices-marry-kevin-kilbane/,dancing on ice’s brianne delcourt says ‘voices in her head’ told her she’d marry kevin kilbane the second she
5.18103328783568,-0.9797511452605386,mirror,https://www.mirror.co.uk/3am/celebrity-news/how-brianne-delcourt-healed-kevin-21433846,how brianne delcourt healed kevin kilbane's heartbreak after secret end to marriage
1,1,"Kevin, Brianne, Delcourt, Dancing, Ice"
