income,grades,district,url,headline
1.6502487994886776,-1.0910163673464417,independent,https://www.independent.co.uk/news/world/europe/cyprus-rape-trial-british-teenager-woman-jail-sentence-ayia-napa-israel-a9273146.html,cyprus rape case: british woman accused of lying about gang attack receives suspended jail sentence
1.3555061912200652,-1.8045496101030705,independent,https://www.independent.co.uk/news/world/europe/cyprus-rape-case-british-woman-president-aiya-napa-lie-trial-sentence-a9267566.html,cyprus rape case: president urged to intervene after british woman found guilty of lying about attack
-0.6495243823626786,-2.6220985536448667,theguardian,https://www.theguardian.com/world/2020/jan/08/the-fight-will-go-on-cyprus-case-woman-arrives-home,lawyers for woman in cyprus rape case prepare appeal request
0.304848166527255,-2.503387276342344,bbc,https://www.bbc.co.uk/news/uk-scotland-51050656,uk police 'discouraged' woman from pursuing cyprus rape case
6.431970653989872,4.344049633274489,theguardian,https://www.theguardian.com/world/2020/jan/07/cyprus-case-what-legal-challenges-does-the-uk-woman-face,cyprus rape case: what legal challenges does the uk woman face?
-4.529024778459439,3.7843920305133927,sky,http://news.sky.com/story/british-teen-convicted-of-lying-about-gang-rape-may-get-pardon-11902530,british woman convicted of lying about cyprus gang rape may get pardon
-3.785387065436091,2.520412696062469,independent,https://www.independent.co.uk/news/world/europe/cyprus-rape-case-british-woman-guilty-verdict-uk-a9275326.html,cyprus rape case: british teenager vows to clear her name after arriving home
-0.7786375849676599,-2.627802552413624,dailymail,https://www.dailymail.co.uk/news/article-7854925/British-girl-accused-lying-Cyprus-gang-rape-tricked-handing-passport.html,british girl accused of lying over cyprus gang rape was 'tricked' into handing over her passport to police within hours of reporting the attack
1,1,"Cyprus, Case, Woman, British, Rape"
