income,grades,district,url,headline
-1.0541385032234012,-3.5567296688534884,metro,https://metro.co.uk/2020/04/01/80-coronavirus-patients-ventilators-will-die-volunteers-told-12493061/,"‘up to 80% of coronavirus patients on ventilators will die’, volunteers told"
-5.401625396181125,3.7452771391149016,metro,https://metro.co.uk/2020/04/01/four-fifths-coronavirus-patients-need-ventilators-will-end-dead-12494626/,‘four fifths of coronavirus patients who need ventilators will end up dead’
1.4077757784834846,-3.0000258384361302,mirror,https://www.mirror.co.uk/news/uk-news/nhs-nightingale-volunteers-warned-up-21794172,nhs nightingale volunteers warned up to 80% of patients on ventilators will die
3.060821158638627,1.4943365318456832,mirror,https://www.mirror.co.uk/news/uk-news/icu-nurse-describes-tears-coronavirus-21816161,icu nurse describes tears of coronavirus patients being put on ventilators alone
5.489225933378092,2.3070644363698745,sun,https://www.thesun.co.uk/news/11309640/ve-taken-elderly-coronavirus/,"ventilators could be taken off elderly coronavirus patients to save younger ones, guidelines say"
-3.502058971095681,-0.9899226000408433,independent,https://www.independent.co.uk/news/world/americas/coronavirus-update-louisiana-cases-map-symptoms-ventilators-today-a9439511.html,coronavirus: number of louisiana patients on ventilators doubles in five days
1,1,"Ventilators, Patients, Coronavirus, Volunteers"
