income,grades,district,url,headline
-3.149243421095302,5.5418465375980555,sky,http://news.sky.com/story/coronavirus-minister-who-heads-outbreak-clampdown-in-iran-has-covid-19-11943083,coronavirus: minister who heads outbreak clampdown in iran has covid-19
-1.254733107738173,-0.47762328460512327,bbc,https://www.bbc.co.uk/news/world-middle-east-51642926,coronavirus: how is iran responding to the outbreak?
4.4762170259702,-2.748617589149365,sky,http://news.sky.com/story/coronavirus-china-depicts-heroic-fight-against-covid-19-but-the-reality-is-very-different-11945304,coronavirus: china depicts heroic fight against covid-19 - but the reality is very different
-1.4947019424226633,0.05142774313139027,sky,http://news.sky.com/story/coronavirus-boris-johnson-says-best-advice-to-stop-covid-19-is-to-wash-your-hands-11945712,coronavirus: boris johnson says 'best advice' to stop covid-19 is to wash your hands
-2.424808412414512,0.27344388481665133,mirror,https://www.mirror.co.uk/news/uk-news/irans-vice-president-diagnosed-coronavirus-21590219,iran's vice-president diagnosed with coronavirus as country battles outbreak
-2.5054390009794076,-2.1749021226632013,sun,https://www.thesun.co.uk/news/11053953/coronavirus-test-catch-covid-19/,what is the coronavirus test and can you catch covid-19 twice?
8.432513653292723,2.233500733178374,bbc,https://www.bbc.co.uk/news/world-asia-51624624,could north korea handle a covid-19 outbreak?
-2.0798047946128695,-2.699075902306778,sky,http://news.sky.com/story/coronavirus-first-uk-infection-hikes-risk-of-domestic-covid-19-outbreak-11946166,coronavirus: first uk infection hikes risk of domestic covid-19 outbreak
1,1,"Coronavirus, Covid-19, Outbreak, Iran"
