income,grades,district,url,headline
3.7383284591506096,-0.8403770751185419,metro,https://metro.co.uk/2020/03/15/italys-coronavirus-death-toll-soars-368-one-day-rising-1809-12401943/,"italy’s coronavirus death toll soars by 368 in one day rising to 1,809"
-3.9855703699542016,4.407876637345314,sun,https://www.thesun.co.uk/news/11211793/milestone-italy-coronavirus-death-toll-overtakes-china/,italy coronavirus death toll overtakes china as another 427 die in one day taking total to 3405
5.974224036051233,2.683099502570271,metro,https://metro.co.uk/2020/03/13/italy-death-toll-jumps-250-one-day-1266-12395412/,"italy death toll jumps by 250 in one day to 1,266"
0.8993988883366653,-0.8780876916745314,sky,http://news.sky.com/story/coronavirus-deaths-in-italy-rise-to-1266-up-250-in-a-day-11957245,"coronavirus deaths in italy up by 250 in a day to 1,266"
-2.3876515714846764,0.5011865418990158,independent,https://www.independent.co.uk/news/world/coronavirus-italy-death-toll-ireland-france-school-closures-india-tourist-ban-covid-19-a9398831.html,"coronavirus: italy death toll rises to more than 1,000 as france and ireland shut schools over pandemic"
-2.1048409138971063,-1.11120849659871,sun,https://www.thesun.co.uk/news/11154509/italy-closes-all-shops-coronavirus-death-toll/,italy closes all bars and shops except pharmacies and food outlets as coronavirus death toll soars almost 200
-0.01824687976022444,-2.7406178903077443,sun,https://www.thesun.co.uk/news/11154509/italy-closes-all-bars-and-shops-except-pharmacies-and-food-outlets-as-coronavirus-death-toll-soars-almost-200-in-a-day/,italy closes all bars and shops except pharmacies and food outlets as coronavirus death toll soars almost 200
-2.1156416484423004,-2.021871528115076,sun,https://www.thesun.co.uk/news/11188717/coronavirus-iran-frees-85000-prisoners-deadliest-day/,"iran frees 85,000 prisoners to combat coronavirus as it suffers deadliest day taking death toll to 853"
1,1,"Coronavirus, Toll, Death, Italy, Day"
